{
  "claim_id": "claim-physics-thermo-info-gate-coherence-v1",
  "confidence": 0.82,
  "created_at": "2026-02-19T14:07:55.066376+00:00",
  "evaluation": "affirm",
  "node_id": "anchor-02-physics-information",
  "node_coordinate": "Node_02",
  "rationale": "Cross-node witness affirms stage request based on artifact and anti-drift checks.",
  "witness_id": "wit-claim-physics-thermo-info-gate-coherence-v1-from-anchor-07-dharmic-jain-epistemics",
  "witness_node_coordinate": "Node_07",
  "witness_node_id": "anchor-07-dharmic-jain-epistemics"
}
